1810 - May,Liverpool,Misc,Half-price riots which began in London and spread round country (enforced lowering of prices),0,0,0,Theatre,Public,??,No,No,The Liverpool Theatre,"The Liverpool Theatre, Liverpool, UK",53.408834,-2.978297,Theatre,Liverpool Theatre,Theatre,"Places of leisure (pubs, theatres, football grounds etc)",No,??,NA,Evening,N,1810-05,1810,May,NA,No
1810 - July,Liverpool,Misc (press gang),"Gathered on Queen's Dock, armed themselves with staves and proceeded to rendez-vous houses where they liberated some seamen, broke windows and furniture. Dispersed by police and militia",0,0,0,Rendez-vous houses,Public,Both,No,No,Cooper's rown and Strand Street,"Cooper's Crown, Liverpool, UK",NA,NA,Rendez vous house,Rendez vous house,Rendez vous house,Rendez vous house,No,Hours,NA,??,,1810-07,1810,July,NA,No
1815 - April,Liverpool,Misc (soldiers),"Knocking on doors, ringing bells, destroying street lamps.
Throwing stones at windows of the Adjunct of the Royal Berkshire Militia
Rioting in the mess room at St Domingo fort",0,0,0,Locals,Public,Both,No,No,"Everton and borough of Liverpool
Near the St Domingo Barracks

St Domingo Barracks","St Domingo Barracks, Liverpool, UK",53.426385,-2.96128,Street,,Street,Streets and fields,No,Hours (repeated over days),NA,Evening,N,1815-04,1815,April,NA,No
1816 - June,Liverpool,Political,Drunken violence by 'men in red ribbons',0,0,0,Election mobs,Public,??,No,No,??,NA,NA,NA,Street,,Street,Streets and fields,No,Days,NA,??,,1816-06,1816,June,NA,Election
1819 - February 22 & 23,Liverpool,Misc (anti-police),"Rescuing prisoners. Fighting with police. Attacking the Bridewell. Pavement pulled up, building attacked, officers beaten and thrown in the water. Prisoners released and paraded around on shoulders of crowd.",1,0,0,The police,Public,Both,No,No,"Old Dock Gates, Darwen's weint, Bridewell and Hanover Street, The Docks, South Shore","Old Dock Gates, Liverpool, UK",53.4025,-2.9886,Street,,Street,Streets and fields,No,Days,1819-02-22,6pm till late (evening) and following morning,Y,1819-02,1819,February,Monday,No
1819 - July 12,Liverpool,Identity,"Orange Parade attacked by Catholics. Accompanied by band, 90 Orange in the parade.",0,0,0,Orange,Public,Both,No,No,Vauxhall,"Vauxhall, Liverpool, UK",53.4210556,-2.9893139,"Streets, pubs",,"Streets, pubs",Streets and fields,No,Hours,1819-07-12,??,,1819-07,1819,July,Monday,12th July
1820 - July 12,Liverpool,Identity,Orange Parade attacked by Catholics (Irish Catholic soldiers involved),0,0,0,Orange,Public,Both,No,No,??,??,NA,NA,Strees,,Strees,Streets and fields,No,Hours,1820-07-12,??,,1820-07,1820,July,Wednesday,12th July
1822 - July 12,Liverpool,Identity,"Orange lodges decide not to hold march but irish catholics went looking for fights in the public houses where celebrations were going on (this happens in 1821, 1822, 1823, and 1824)",0,0,0,Orange,Public,Both,No,No,??,??,NA,NA,Streets,,Streets,Streets and fields,No,Hours,1822-07-12,??,,1822-07,1822,July,Friday,12th July
1824 - July 1,Liverpool,Identity,Orange lodges celebrate battle of Boyne in pubs and again similar disorder,0,0,0,Orange,Public,Both,No,No,??,??,NA,NA,Pubs,,Pubs,"Places of leisure (pubs, theatres, football grounds etc)",No,Hours,1824-07-01,??,,1824-07,1824,July,Thursday,12th July
1824 - December 13 & 15,Liverpool,Misc,"Hooting and demands to see the manager at theatre. Audience in upper seats an gallery threw oranges, apples onto stage and pit, seats torn up and thrown at the chandelier, audience in the pit fled, rioters pulled plaster off the walls and threw it at performers.
On Wednesday night same again. Benches thrown at stage. Several people arrestsed, two of them 'genteel looking young men'.",0,0,0,Theatre,Public,Both,No,Theatre manager,Liverpool Theatre Royal,"Liverpool Theatre Royal, Liverpool, UK",53.4074408,-2.981193,Theatre,Liverpool Theatre Royal,Theatre,"Places of leisure (pubs, theatres, football grounds etc)",No,Days,1824-12-13,Evening,N,1824-12,1824,December,Monday,No
1826 - June 12,Liverpool,Political,"Attacking anyone wearing red or supporting Husskinson MP (think he was a Tory), threw stones at the windows in a house on Castle Street where several women were exhibiting scarlet colours, destroyed several flags. At the hustings.",0,0,0,Tories,Both,Both,Yes,Tory supporters,The Hustings and Castle Street,"Castle Street, Liverpool, UK",53.4061593,-2.9907395,"Streets, homes",,"Streets, homes",Streets and fields,No,Hours,1826-06-12,Morning,Y,1826-06,1826,June,Monday,Election
1829 - July 10,Liverpool,Misc (anti-police),Attempted prisoner rescue,1,0,0,Police,Public,Both,No,No,Race ground,"Race ground, Liverpool, UK",53.4712102,-2.9541455,Race ground,,Race ground,"Places of leisure (pubs, theatres, football grounds etc)",No,Minutes,1829-07-10,??,,1829-07,1829,July,Friday,No
1831 - October 22,Liverpool,Political,"Lord Sandon's parade attacked at various points by mud, stones, old shoes, dead cat, bottles and other missiles being thrown at him.
Constant din at his meeting beforehand",0,0,0,Lord Sandon's parade,Public,Both,No,Lord Sandon,"Castle Street, Lord Street, Duke Street","Castle Street, Liverpool, UK",53.4061593,-2.9907395,Street,,Street,Streets and fields,No,Hours,1831-10-22,Day time,Y,1831-10,1831,October,Saturday,Election
1832 - May/June,Liverpool,Misc (Cholera),"""Crowds targeted the cholera hospitals, set up by the new local boards of health, and the palanquin carts which were rumoured to carry (p.133) stolen pauper bodies.10 The Anatomy Act was a connected cause. Passed during the same session as the Reform Act, the legislation allowed surgeons to claim the bodies of paupers who had died in workhouses or hospitals if those corpses were unclaimed for burial.11 Gothic literature such as Mary Shelley’s Frankenstein (1818) shaped popular imagination about dissection, and fears were heightened further by the infamous Burke and Hare murders in Edinburgh in 1828. Rumours arose that hospital governors would use the clause to their financial advantage, especially after the new poor law enabled the construction of workhouses as punitive institutions designed to increase efficiency. Marxist historians have argued that the populace regarded the Anatomy Act as a piece of class legislation; Gwyn Williams described it as ‘the pursuit of the propertyless beyond the grave’.12 As with radical reform protests, the issue revolved around the non-propertied and non-represented being excluded from the civic body politic. This time, they were excluded not just in life, but also in death. The main opponent of the bill in parliament was Henry Hunt, then MP for Preston, who thereby cemented connections between the issue, radical politics and the legacy of Peterloo.13

The cholera and anatomy rioters mirrored the tactics of food rioters, employing prior threats and community justice against perpetrators of immoral actions seen to have transgressed moral norms."" Navickas (2016) p. 131",0,0,0,Cholera hospitals,Public,Both,No,No,Across the town,"Across the town, Liverpool, UK",NA,NA,Cholera hospitals,,Cholera hospitals,Hospital,No,Weeks,NA,??,,1832-05,1832,May,NA,No
1835 - July 12 & 13,Liverpool,Identity,"Groups collecting together to stop Orange march, armed with bludgeons, daggers, pistols and weapons. Found no march and eventually dispersed to pubs looking for fights with Orangemen. Groups marching up and down Vauxhall Road. Prisoner rescue. Fighting with watchmen. Stone throwing. Releasing prisoners and destroying the lock-up. Breaking of windows. Assaulting 'respectable citizens'. Houses with yellow blinds or people with yellow handkerchiefs attacked.",1,0,0,"Orangemen, buildings, Police, lock-ups, private gentlemen",Public,Both,No,No,"Tithebarn Street, Vauxhall Road, Marybone, Ben Johnson Street, Great Crosshall Street, Vauxhall Street, Park Lane, Vauxhall Road","Tithebarn Street, Liverpool, UK",53.4096489,-2.989783,"Streets, pubs",,"Streets, pubs",Streets and fields,No,Days,1835-07-12,Evening (10pm) and daytime (11am/noon),Y,1835-07,1835,July,Sunday,12th July
1837 - March 10 & 11,Liverpool,Economic,Industrial dispute violence Mates vs Sailors. Power play. Marching. Not enforcing strike so much as intimidation,0,0,0,Mates vs sailors,Public,Both,No,No,"Docks, Union Street","Union Street, Liverpool, UK",53.4088038,-2.9948349,Sailors House,,Sailors House,"Workplaces (factory, workshops, docks etc)",Yes,Days,1837-03-10,Evening (9pm) then morning,Y,1837-03,1837,March,Friday,No
1837 - July 14,Liverpool,Political,"Whig meeting on Upper Pitt Street accompanied by 'perambulating Irish audience"", porters and market-women. Speeches on topic of ""cheap tea and no monopoly"", populist appeal to 'popular reason and rights'. Irish in crowd, along with porters and market-women. Freemen who were at the meeting and boo-ed then attacked by Whig mob. Specials sworn in. Disorder subsided by 4pm. Accusation that the police (who are run by the Whigs) allowed the disturbances to go on.",0,0,0,Meeting,Public,People,No,No,Upper Pitt Street,"Upper Pitt Street, Liverpool, UK",53.3978357,-2.9789188,Open air meeting,,Open air meeting,Streets and fields,No,Hours,1837-07-14,Afternoon (over by 4pm),Y,1837-07,1837,July,Friday,No
1837 - July 24 & 25,Liverpool,Political,"Attacks on everyone wearing conservative colours. Evidence that the mob had read 'inflamatory pamphlets' handed around in days before the election. Protestant Irish woman assaulted in Greenland Street, late Conservative candidate stoned in his carriage, woman who sells the Liverpool Mail attacked, St James Market had to be closed. Robbing respectable individuals who got drawn in by curiosity. Mass meeting with speeches. Freemen attacked by Whig mob. Specials sworn in. Disorder subsided by 4pm. Fighting police and attacking election booths. Rival groups parading around",1,0,0,"Rival mobs, freemen/electors, Police, 'respectable gentlemen', election booths",Public,Both,No,Tory supporters. Former Tory candidate,"St James Street, Paradise, White Chapel, Tithebarn, Vauxhall Road, Park Lane, Great George Street, Tithebarn Street, Moorfields, Toxteth Park and South End in general","St James Street, Liverpool, UK",53.3967169,-2.9791971,"Streets, election meeting rooms, houses, pubs",,"Streets, election meeting rooms, houses, pubs",Streets and fields,No,Days,1837-07-24,Day (10am till 4pm) and night,Y,1837-07,1837,July,Monday,Election
1839 - May 21,Liverpool,Political,Fight at Chartist meeting. Cart broken up to use as weapon,0,0,0,Chartists,Public,Both,No,No,Queen Square,"Queen Square, Liverpool, UK",53.407979,-2.983797,Open air meeting,,Open air meeting,Streets and fields,No,Hours,1839-05-21,Evening,N,1839-05,1839,May,Tuesday,No
1839 - May 22,Liverpool,Misc,Irish mob surround house trying to kill owner. Throwing bricks and stones. Owner severly beaten,0,0,0,Private home and person,Private,Both,Yes,No,Harrison Street,"Harrison Street, Liverpool, UK",53.3820691,-2.9777459,House,,House,Home,No,Hours,1839-05-22,Night,N,1839-05,1839,May,Wednesday,No
1839 - May 30 & 31,Liverpool,Identity,"Parading in carriages with flags and banners. Stoning carriages and back at houses. Revenge attacks. Particular pub attacked. Fighting. Police in the middle. Rumours spreading. Arming themselves to defend Chapel. Armed with axes, pistols, hatchets etc. Fighting on the docks.",0,0,0,"Irish locas, Ships carpenters, specific buildings/people",Public,Both,No,No,"New Bird Street, Crosby, Jordan and Starling streets. Simpson street, Blundell street, Newhall street, Park Lane, ","New Bird Street, Liverpool, UK",53.3952205,-2.9795365,"Streets, houses, pubs",,"Streets, houses, pubs",Streets and fields,No,Days,1839-05-30,Start in evening (7pm). All through next day,Y,1839-05,1839,May,Thursday,No
1840 - November 8,Liverpool,Misc,Righting between Irish factions,0,0,0,Rival Irish factions,Public,Both,No,No,Lace street,"Lace street, Liverpool, UK",53.4115545,-2.9853322,Street,,Street,Streets and fields,No,Minutes,1840-11-08,Noon or 2pm,Y,1840-11,1840,November,Sunday,No
1841 - January,Liverpool,Identity / Political,Orangemen and carpenters break up a free trade meeting,0,0,0,Free trade meeting,Public,Both,No,No,??,??,NA,NA,Meeting,,Meeting,Meeting Hall,No,Minutes,NA,??,,1841-01,1841,January,NA,No
1841 - June (early),Liverpool,Identity / Political,"South End anti-Corn Law meeting held, ships carpenters barracked the meeting and on way home smashed windows of St Patricks Catholic Church. Next day at another Anti-Corn Law League meeting even more irish in crowd and attack several people and on way home smashed windows of St James Anglican Church in Toxteth. Next day 2000 Orange and carpenters marched from docks to town centre demanding police protection from Irish attacks",0,0,0,Irish vs Ships Carpenters,Public,Both,No,No,Toxteth and Stouth End,"Toxteth, Liverpool, UK",53.3864273,-2.967451,Open air meeting,,Open air meeting,Streets and fields,No,Minutes,NA,??,,1841-06,1841,June,NA,No
1841 - June 30,Liverpool,Political / Identity,"Attacking private homes. Stoning police. Rival political parties fighting. Armed mobs. Climbing on roofs to pelt the police below with slates, bricks, chimney etc. Fighting police. Smashing windows of rival party's pubs. Two shops broken into late at night. Unrest happened after election - raucous celebration escalates. Offices of rival newspapers attacked. Armed mobs parading. Smashing windows as they went. Respectable people and their houses attacked. Pub and drapers attacked and gutted. Enforced boycott of Tory shop (picketing outside it). ",0,0,0,Irish vs Ships Carpenters (as Reformers vs Tories). Police. Private homes. Specific pubs/shops. Respectable gentlemen and their homes,Both,Both,Yes,Election groups,"Tithebarn, Rodnet street, New Bird street, Newhall, Crosby street, Fisher street, Mersey street, Park Lane, Simpson street, Kent street, Fenton street, Town Hall, Salthouse dock. Fontenoy street, St James street. Dale street. Vauxhall road (north end). Great Crosshall street, Standish street, Sawney Pope street, Atherton street.Toxteth park. Richmond Row, Byrom street","Tithebarn, Liverpool, UK",53.4111037,-2.9883914,"Streets, houses, pubs",,"Streets, houses, pubs",Streets and fields,No,Hours/ Days,1841-06-30,"4pm starts, over by 10pm",Y,1841-06,1841,June,Wednesday,Election
1842 - June 13,Liverpool,Identity,Faction fight in Toxteth park. Police intervene are attacked,0,0,0,Rival factions. Police,Public,Both,No,No,Toxteth Park,"Toxteth Park, Liverpool, UK",53.3864273,-2.967451,Park,,Park,Streets and fields,No,Hours/minutes,1842-06-13,Evening,N,1842-06,1842,June,Monday,No
1842 - July 12,Liverpool,Identity,Orange celebration in pubs. Irish mobs meet them to fight. Parade cancelled but dissident protestants held procession anyway - were attacked,0,0,0,Orange,Public,Both,No,No,North part of the town,"North End, Liverpool, UK",NA,NA,"Streets, pubs",,"Streets, pubs",Streets and fields,No,Hours,1842-07-12,Morning (7am) and through day till evening,Y,1842-07,1842,July,Tuesday,12th July
1843 - May 30,Liverpool,Political / Identity,Chartist meeting on repeal of union attacked by carpenters' apprentices. Windows smashed,0,0,0,Chartist/Repealer meeting,Public,Both,No,No,Lord Nelson street,"Lord Nelson Street, Liverpool, UK",53.4084289,-2.9765224,Meeting,,Meeting,Meeting Hall,No,Minutes,1843-05-30,Evening,N,1843-05,1843,May,Tuesday,No
1843 - June 4,Liverpool,Economic,Riot in Liverpool workhouse. Menacing marching. Demanding their liberty.,0,0,0,Workhouse. Workhouse officers,Public,Both,No,No,??,"?? Liverpool, UK",NA,NA,Work house,,Work house,"Workplaces (factory, workshops, docks etc)",Yes,Days,1843-06-04,Early afternoon,Y,1843-06,1843,June,Sunday,No
1843 - September 12,Liverpool,Political / Identity,Repealers meeting. Disruption by ships carpenters who are attacked by porters with crowd cheering on. Police break it up and escort out the carpenter,0,0,0,Repealer meeting. Carpenters disrupting,Public,Both,No,No,Royal Amphitheatre,"Royal Amphitheatre, Liverpool, UK",53.4074408,-2.981193,Meeting,Royal Amphitheatre,Meeting,Meeting Hall,No,Minutes,1843-09-12,Evening (7PM),N,1843-09,1843,September,Tuesday,No
1845 - March 17,Liverpool,Misc (anti-police),"""Lifting women"" Police intervene and are attacked. Arrested but police stoned all the way to the bridewell",1,0,0,Police,Public,Both,No,No,Vauxhall Road,"Vauxhall Road, Liverpool, UK",53.4184106,-2.9898577,Street,,Street,Streets and fields,No,Hours,1845-03-17,4.30pm,Y,1845-03,1845,March,Monday,Traditional Easter
1845 - July,Liverpool,Identity,Orange funeral procession attacked. Attack on police. Irish armed. Stone throwing,0,0,0,"Orangemen, Police",Public,Both,No,No,"Byron Street, Great Crosshall Street, Lace street, Fontenoy street","Shaws Brow, Liverpool, UK",53.409439,-2.98025,Pub,,Pub,"Places of leisure (pubs, theatres, football grounds etc)",No,Hours,1845-07-06,Afternoon (over by 5pm),Y,1845-07,1845,July,Sunday,No
1845 - July 6,Liverpool,Identity,Attack on Orangeman in pub by Irish mob. Police intervene and are themselves attacked.,0,0,0,"Orangemen, Police",Public,Both,No,No,Shaws Row,"Byrom Street, Liverpool, UK",53.4117715,-2.9822757,Street (procession),,Street (procession),Streets and fields,No,Hours,NA,??,,1845-07,1845,July,NA,No
1845 - July 17,Liverpool,Identity,Mob parading outside houses of suspected Orangemen. ASsaulting passersby,0,0,0,"Orangemen, passersby",Private,Both,Yes,No,Seddon and Federick Streets,"Seddon Street, Liverpool, UK",53.4017817,-2.9853378,House,,House,Home,No,Hours,1845-07-17,Evening,N,1845-07,1845,July,Thursday,12th July
1847 - November,Liverpool,Identity,Irish mob attack Chapel,0,0,0,Protestant Chapel,Public,Both,No,No,Bishpam street,"Bispham Street, Liverpool, UK",53.41213,-2.985899,Chapel,,Chapel,Church,No,Hours,NA,??,,1847-11,1847,November,NA,No
1848 - June 9,Liverpool,Identity,Gang of Irish trawling pubs looking for Orangemen to attack,0,0,0,Orangemen,Public,Both,No,No,Pubs,??,NA,NA,Pub,,Pubs,"Places of leisure (pubs, theatres, football grounds etc)",No,Hours,1848-06-09,??,,1848-06,1848,June,Friday,No
1849 - May,Liverpool,Identity,Men from Sligo and Mayo fought a battle in St Martin's street only a few days after a similar fight in Lace Street. Several policemen injured in the disturbance,0,0,0,Intra-Irish fighting,Public,Both,No,No,"St Martin's street, Lace Street","St Martin's street, Liverpool, UK",53.421354,-2.982713,Street,,Street,Streets and fields,No,Days,NA,??,,1849-05,1849,May,NA,No
1850 - May,Liverpool,Identity,Police vs navvies fighting,0,0,0,Police,Public,Both,No,No,??,??,NA,NA,Street,,Street,Streets and fields,No,Hours,NA,??,,1850-05,1850,May,NA,No
1850 - July 12 & 13,Liverpool,Identity,Orange riot at house of beerseller. Stone throwing. Shooting. Police arrive to defend the house. Crowd throwing stones and breaking windows.,0,0,0,Orange beer seller's house,Private,Both,Yes,No,Chadwick street,"Chadwick street, Liverpool, UK",53.4160983,-2.9951942,House,,House,Home,No,Days,1850-07-12,Night,N,1850-07,1850,July,Friday,No
1850 - October,Liverpool,Identity,Irish flute player attacked by Protestants.,0,0,0,Irish flute player,Public,Both,No,No,??,??,NA,NA,Street,,Streets,Streets and fields,No,Minutes,NA,??,,1850-10,1850,October,NA,No
1850 - November 28,Liverpool,Identity,"Mob surround meeting trying to gain entrance. Fight with police. Armed. Stoning building, throwing brickbats. Tearing out iron railings. Rescuing prisoners",1,0,0,Police. Protestant meeting.,Public,Both,No,No,Birkenhead Town Hall,"Birkenhead Town Hall, Liverpool, UK",53.3932282,-3.0142556,Meeting,Birkenhead Town Hall,Meeting,Meeting Hall,No,Hours,1850-11-28,11am (crowds assembled since 9am) then all through the day,Y,1850-11,1850,November,Thursday,No
1851 - June 30,Liverpool,Misc (soldiers / anti-police),Soldiers attacking police (after tit for tat escalation). Crowd cheering soldiers on in their fight. Soldiers initially attacking passersby. Rescuing prisoners,1,0,0,Police,Public,Both,No,No,"St Anne street, Dale Street.","St Anne street, Liverpool, UK",53.414002,-2.9778986,"Streets, pubs",,"Streets, pubs",Streets and fields,No,Days,1851-06-30,Evening (9pm),N,1851-06,1851,June,Monday,No
1851 - July,Liverpool,Political,Attacking electors as they went to the polls. Throwing stones and missiles,0,0,0,Electors,Public,Both,No,No,Scotland Road,"Scotland Road, Liverpool, UK",53.4200719,-2.981921,Polling booths,,Polling booths,Streets and fields,No,Hours,NA,??,,1851-07,1851,July,NA,Election
1851 - July 14,Liverpool,Identity,"Orange processsion with flags and bands, attacked by Irish. Barrage of stones and brickbats. Armed with swords and pistols. Parade went ahead. But then fresh rioting in evening. Attaking police, volleys of stones. Attacking 'respectable people' who happened to be on the parade route. ",0,0,0,Orange parade. Police. Respectable people,Public,Both,No,No,"Seymour street, Greek street, Duke and Great George streets, Park Lane, Glocester street and Shaw's Brow. Scotland Road. Marybone, Sawney Pope, Great Crosshall and Fentonoy Street. Byrom, Duncan and Fox streets.","Seymour street, Liverpool, UK",53.4084206,-2.9740816,Street (procession),,Street (procession),Streets and fields,No,Hours,1851-07-14,"Morning (9am) then 2-3pm, then evening (9-10pm)",Y,1851-07,1851,July,Monday,12th July
1851 - August 12,Liverpool,Identity,Catholics fighting protestants. Protestants taken to bridewell for protection and followed all the way,1,0,0,Protestants,Both,Both,Yes,No,Scotland Road,"Scotland Road, Liverpool, UK",53.4200719,-2.981921,Street (procession),,Street (procession),Streets and fields,No,Hours,1851-08-13,Afternoon,Y,1851-08,1851,August,Wednesday,No
1851 - August 13,Liverpool,Identity,Orange parade supressed by police. Lots of firearms discovered,0,0,0,Protestants vs police,Public,Both,No,No,Lace street. Vauxhall Bridewell,"Lace street, Liverpool, UK",53.4115545,-2.9853322,Street,,Street,Streets and fields,No,Minutes,1851-08-12,??,,1851-08,1851,August,Tuesday,No
1852 - February 9,Liverpool,Misc (anti-police),Police arrest someone and are beaten in prisoner rescue,1,0,0,Police,Public,Both,No,No,Vauxhall Road,"Vauxhall Road, Liverpool, UK",53.4184106,-2.9898577,Street,,Street,Streets and fields,No,Hours,1852-02-09,??,,1852-02,1852,February,Monday,No
1852 - February 23,Liverpool,Identity / Misc (anti-police),Police attack Irish crowd coming out of Holy Cross Chapel,0,0,0,Irish,Public,Both,No,No,Holy Cross Chapel,"Holy Cross Chapel, Liverpool, UK",53.4122423,-2.9841139,"Street, Chapel",,Chapel,Church,No,Hours,1852-02-23,??,,1852-02,1852,February,Monday,No
1852 – April,Liverpool,Misc (anti-police),Police arrest someone for assaulting open air preacher. They are then stoned and attacked by mob,1,0,0,Police,Public,Both,No,No,,"Liverpool, UK",NA,NA,Street (procession),,Street (procession),Streets and fields,No,Minutes,1852-05-06,Evening (7-8pm),N,1852-05,1852,May,Thursday,No
1852 - May 6,Liverpool,Identity,Orange funeral procession attacked.,0,0,0,Orange funeral procession,Public,Both,No,No,Banastre Street (marybone end),"Marybone, Liverpool, UK",53.411874,-2.986661,Open air meeting,,Open air meeting,Streets and fields,No,Minutes,1852-05-01,??,,1852-05,1852,May,Saturday,No
1852 – May,Liverpool,Identity,Orange vs Catholic fight after Orangemen chastise CAtholic child for throwing mud,0,0,0,Irish vs Protestants.,Public,Both,No,No,??,"Liverpool, UK",NA,NA,Street,,Street,Streets and fields,No,Minutes,1852-04-01,??,,1852-04,1852,April,Thursday,No
1852 - July 6,Liverpool,Political / Identity,Crowded election day. House stoned after owner fired shot out. Carriages of voters attacked for bearing wrong colours.,0,0,0,Electors and private home,Both,Both,Yes (after he shot out at crowd),No,"St Martin Street, Scotland Road, Sawney pope, Bispham street, Scotland place. ","Bispham Street, Liverpool, UK",53.41247,-2.983795,House,,House,Home,No,Hours,1852-07-06,Day,Y,1852-07,1852,July,Tuesday,No
1852 - July 12,Liverpool,Identity,Orange lodge marches attacked,0,0,0,Orange parades,Public,Both,No,No,South and North end,"??, Liverpool, UK",NA,NA,??,,??,??,No,Hours,1852-07-12,??,,1852-07,1852,July,Monday,12th July
1852 - August 12,Liverpool,Identity,Orange parade supressed by police. Lots of weapons discovered,0,0,0,Protestants vs police,Public,Both,No,No,Great Homer street and Fox street,"Great Homer street, Liverpool, UK",53.4226107,-2.9784633,Street (procession),,Street (procession),Streets and fields,No,Hours,1852-08-12,Morning,Y,1852-08,1852,August,Thursday,No
1852 - August 28,Liverpool,Identity,Anglican church attacked during sermon by irish mob,0,0,0,Anglican church,Public,Both,No,No,St Bartholomew's,"St Bartholomews, Liverpool, UK",53.41402,-2.98705,Church,St Bartholomews,Church,Church,No,Minutes,1852-08-28,Day (during sermon),Y,1852-08,1852,August,Saturday,No
1852 - September 5,Liverpool,Misc (anti-police),"Faction fight between irish. Polic intervene and are seriously beaten. Armed with sticks, brickbats and stones. Climb on roofs to pelt the police",0,0,0,Police,Public,Both,No,No,"Hodson street, Vauxhall Road","Hodson street, Liverpool, UK",53.412785,-2.982873,Street,,Street,Streets and fields,No,Hours,1852-09-05,Midnight,N,1852-09,1852,September,Sunday,No
1852 - November 8,Liverpool,Economic,Dispute of ownership of train bridge to the dock. Dock trsutees try to stop train passing. Workers of docks fighting workers of railway.,0,0,0,Dock workers vs railway workers,Public,Both,No,No,Birkenhead docks,"Birkenhead docks, Liverpool, UK",53.403072,-3.016079,Docks,Docks,Docks,"Workplaces (factory, workshops, docks etc)",Yes,Hours,1852-11-08,Evening (8pm),N,1852-11,1852,November,Monday,No
