Date,City,Category,Behaviours,Prison rescue,Begging,Factory visiting,Target,Public/Private,People/Property,People targeted in their homes?,Specific individuals targeted?,Locations,Start point,Latitude,Longitude,Space,Place,Starting Place,Type of space,Industrial,Duration,First day,Time,Working hours (7-7),monthyear,year,month,Weekday,Special date
1807 - July 13,Manchester,Identity,"Fighting with sticks, bludgeons and a stabbing.
Band playing Orange tunes and ""No Popery"" chalked up on the walls. Carrying banners as part of the march.
Troops called out to restore order",0,0,0,People in public,Public,People,No,No,"Church Street, High Street (near the Catholic meeting place of Roman Entry).","Church Street, Manchester, UK",53.4829775,-2.2374786,"Street (procession). The location is significant, being very close to the Catholic meeting place in Roman Entry",,Street (procession),Streets and fields,No,Hours,1807-07-13,??,,1807-07,1807,July,Monday,12th July
1808 - May/June,Manchester,Economic,"Daily ritual of mass meetings. People marching in from neighbouring town. Riot Act read and charges of the troops and men shot at. 
Strike. People arrested, in the evening mob returned and released the prisoners and set fire to the gaol (2 bags of shuttles had been deposited at the House of Correction). Pamphlets being printed to reassure weavers that no agreement had been reached (combatting misinformation). Soldiers pouring into Manchester from all around. Attacks on scabs - taking away shuttles, cutting their pieces, stop all workers carrying finished pieces and send them home. Distributing food amongst the crowd. Lots of Irish amongst those arrested. Burned in effigy many of the town's manufacturers. Women more turbulent and mischievous than the men. Threatening to pull down the houses of scabs. Destroying pieces with vitriol dropped on works through cracks in windows.
In general strike carried out with little violence. (Many 1000s involved)",1,0,1,"Scabs and looms.
Also weaver's private houses.
Police and gaol.",Both,Both,Yes,Scabs,St George's Fields and all around,"St George's Fields, Manchester, UK",53.490063,-2.229838,Open air meeting,St George’s Fields,Open air meeting,Streets and fields,Yes,Weeks,NA,??,,1808-05,1808,May,NA,No
1812 - April,Manchester,Economic,"Mass meeting with speeches. Broke into Exchange Building smashing furniture etc throwing it into street to set on fire. Breaking windows. Riot Act read, militia deployed.
Visiting factories and houses in Stockport. Burning down private houses and destroying furniture (often of employers). Smashing windows, power looms and pieces being worked on. Targeting specific people. Headed by two men in women's clothes (""wives of Ludd""). Entering shops and taking everything. Stoning coaches. Firing muskets into factories. Holding nocturnal meetings. Targeting factories which are 'weaving by steam'. Trying to raise up bread riot and lower prices (Rochdale). Trying to bribe militiamen to join them. Woman about to give evidence against Luddites killed. Rescuing prisoners. Workers inside factories firing out and defending them. Murdering police who they tried to 'twist in'. Inflamatory bills posted around the town. Leaders of mob giving orders - attacking 'spies'. (Many 1000s involved)",0,0,1,"Employers, police, scabs.
Factories, private homes and public buildings.
Also shops/markets.
Destroying power looms specifically",Both,Both,Yes,"Scabs, employers","Market Place and St Anne's Square (Exchange).
Stockport and Edgeley. Middleton. Rochdale. 
Shudehill. Deansgate. Ancoats. 
Ashton","Exchange Buildings, Manchester, UK",53.484197,-2.243509,Exchange,The Exchange,Exchange. Starts at public meeting,"Workplaces (factory, workshops, docks etc)",Yes,Months,NA,"Afternoon, daytime and evenings",Y,1812-04,1812,April,NA,No
1818 - July 15,Manchester,Economic,"Strike. Very disciplined (peaceable, picketing in orderly fashion, marching in military style, Ok-level of intimation etc).
Destroying the victuals of scabs left outside for their lunch. Arson at night. Dead and skinned rabbit hoisted on lampost at Deansgate.
Annonymous letter threatening to kill solicitor.
In Stockport two or three nights of riot as power-loom weavers attacked factories, smashed windows, intimidated workers, stones and brickbats thrown at cavalry.",0,0,1,"Factories, scabs and military",Public,Both,No,No,Stockport,"Stockport, Manchester, UK",53.4106316,-2.1575332,Factories,,Factory,"Workplaces (factory, workshops, docks etc)",Yes,Hours,1818-07-15,Night,N,1818-07,1818,July,Wednesday,No
1818 - July,Manchester,Misc (anti-police),Fighting with police. More people join. General fight. Smashing several pubs up as they pursued the police,0,0,0,Police,Public,Both,No,No,"Ancoats (White Horse pub, Ancoats lane; Robin Hood pub, Newton Lane)","White Horse pub Ancoats lane, Manchester, UK",53.481671,-2.226521,Pub,White Horse pub,Pub,"Places of leisure (pubs, theatres, football grounds etc)",No,Hours,NA,Evening,N,1818-07,1818,July,NA,No
1818 - September 2,Manchester,Economic,"Strike. Every morning and evening violence against workers (using stones and mud). Attacking and hooting respectable looking gentlemen. Marching in rank and file to demand factories demanding workers turn out. Stealing staves from police/soldiers. Stoning and shooting into and out of factories. Assembling on St Georges. Attacking mills. 
Weavers marching into the town from Ashton, Oldham and Middleton. 
Dragoons fire warning shots over heads then fire directly at crowds. Marching out to Ashton with flags and music (intercepted and sent home peacefully by magistrates). (Many 1000s involved)",0,1,1,"Factories, scabs, local gentlemen, police/troops.",Public,Both,No,No,Ancoats. St Georges Fields. Pollard street. ,"St George's Fields, Manchester, UK",53.490063,-2.229838,Open air meeting,St George’s Fields,Strike on going,Streets and fields,Yes,"Days, escalating to the 2nd",1818-09-02,Every evening and morning. Midday,Y,1818-09,1818,September,Wednesday,No
1819 - January 22,Manchester,Political,"Riot in a theatre when Mr Hunt attended. Fighting, hooting  and singing",0,0,0,Loyalists vs Reformers,Public,Both,No,Henry Huny,Theatre,Theatre,NA,NA,Theatre,,Theatre,"Places of leisure (pubs, theatres, football grounds etc)",No,Hours,1819-01-22,Evening,N,1819-01,1819,January,Friday,No
1819 - February 15,Manchester,Political,Riotous meeting. Hoisting different flags and pulling down Reformers vs Loyalists. Stoning soldiers. Assaulting local gentleman,0,0,0,"Loyalists vs Reformers.
Troops and son of local solicitor",Public,Both,No,Local Gentleman,"Stockport. Windmill Schoolrooms (where soldiers stationed), market place","Market Place Stockport, Manchester, UK",53.4113408,-2.1567149,Open air meeting. Market,Market Place,Open air meeting,Streets and fields,No,Hours,1819-02-15,??,,1819-02,1819,February,Monday,No
1819 - August 16,Manchester,Political,Peterloo. Clashes in Irish area of the city around New Cross for next few days between crowd and police but Hunt and other radical leaders urged crowds not to retaliate! (Busteed - Irish in Manchester p.148),0,0,0,Police,Public,Both,No,No,New Cross,"New Cross, Manchester, UK",53.484599,-2.233182,Street,,Street,Streets and fields,No,Days,1819-08-16,??,,1819-08,1819,August,Monday,No
1823 - January 1,Manchester,Identity,Fighting with sticks,0,0,0,English vs Irish,Public,People,No,No,"Swan Inn, Deansgate
Lad Lane","Swan Inn Deansgate, Manchester, UK",53.478007,-2.249658,Pub,Swan Inn,Pub,"Places of leisure (pubs, theatres, football grounds etc)",No,Hours,1823-01-01,Afternoon,Y,1823-01,1823,January,Wednesday,No
1825 - May 22,Manchester,Identity,Fighting. Escalated from one-on-one fight.,0,0,0,English vs Irish,Public,People,No,No,St George's Road (4pm),"St George's Road (Rochdale Road), Manchester, UK",53.489617,-2.229644,Street,Street,Street,Streets and fields,No,Hours,1825-05-22,4pm afternon,Y,1825-05,1825,May,Sunday,No
1825 - December 11,Manchester,Identity,"Irish attacking pub owners, then police and pub itself.",0,0,0,Police and pub,Public,Both,No,No,"Red Bull Inn, Mason Street, Shudehill","Red Bull Inn Mason Street, Manchester, UK",53.487419,-2.232271,Pub,Red Bull Inn,Pub,"Places of leisure (pubs, theatres, football grounds etc)",No,Hours,1825-12-11,Evening 11pm,N,1825-12,1825,December,Sunday,No
1826 - April 19-29,Manchester,Economic,"Entering provision stores, taking provisions and demanding money.
Spinners striking against lowering of wages.
Begging from shops and people. 
Mugging respectable looking people of their watches.
Stoning police/troops in evening (stones, brickbats, paving stones)
Marching in formation through the town.
Attack power-loom factories with stones. Breaking in and destroying machinery and furniture. Attacking knobsticks and throwing them in the canal. Factory workers firing out to defend their factory. 
Carefully targetting power-loom factories. 
'already done enough petitioning', ""What must I do? I can not get work. My wife and children are famishing before my eyes; and if I don't beg we must lay ourselves down and die""
Barricades of large stones across the roads. (Many 1000s involved)",0,1,1,"Factories, machinery and counting machines, knobsticks, police/troops and gentlemen.
Also shops",Public,Both,No,"Scabs, respectable looking people","St George's Fields, Oak Street, Long Millgate, Jersey Street, New Cross, Oldham Street, Ancoats Lane, Newton Lane, Chorlton Row, Pollard Street, Port Street, Miller Street","Ancoats Lane, Manchester, UK",53.481587,-2.226694,"Shops, factories, streets",,Factory,"Workplaces (factory, workshops, docks etc)",Yes,Weeks,1826-04-24,Starts in evening (7.30pm) then in day times,N,1826-04,1826,April,Wednesday,No
1826 - May 14,Manchester,Misc,Sunday riot Kersal Moor. Fighting with bludgeons,0,0,0,Crowd vs men from Hollinwood,Public,People,No,No,Kersal Moor,"Kersal Moor, Manchester, UK",53.515278,-2.276389,Fete,,Fete,"Places of leisure (pubs, theatres, football grounds etc)",No,Hours,1826-05-14,Morning,Y,1826-05,1826,May,Sunday,No
1826 - June,Manchester,Economic,"Attacks on knobsticks
Meetings in St George's Field and a field near Travis Street Canal, Ancoats (Many 1000s)",0,0,0,Knobsticks,Public,People,No,No,"st george's field. Travis Street canal, Ancoats","St George's Fields, Manchester, UK",53.490063,-2.229838,Streets,,Streets,Streets and fields,Yes,Weeks,NA,??,,1826-06,1826,June,NA,No
1826 - September,Manchester,Economic,Fight between old and new hands. Women used to replace strikers,0,0,0,Old hands,Public,People,No,No,??,??,NA,NA,Factories,,Factories,"Workplaces (factory, workshops, docks etc)",Yes,Hours,NA,??,,1826-09,1826,September,NA,No
1827 - May,Manchester,Misc (bailiff),Rioters attacking houses after bailiffs emptied them (people behind on their rent),0,0,0,Houses just emptied by bailiffs,Public (Bailiff),Property,No,No,Cropper Street,"Cropper Street, Manchester, UK",53.4805464,-2.2348396,House,,House,Home,No,Hours,NA,??,,1827-05,1827,May,NA,No
1828 - January 30,Manchester,Misc,Fight at meeting of police commissioners in Town Hall,0,0,0,,Public,People,No,No,Town Hall,"Town Hall, Manchester, UK",53.478923,-2.2440034,Meeting (police commissioners election),Town Hall,Meeting,Meeting hall,No,Minutes,1828-01-30,Morning,Y,1828-01,1828,January,Wednesday,No
1828 - July 27,Manchester,Misc (anti-police),"Fighting police with fists and brickbats.
Irish fighting each other but then ganged up on police when they tried to interfere.
Rescue prisoner (man shouted ""I am a Roman Catholic"" as was arrested)",1,0,0,Police,Public,People,No,No,Canal Street and Ancoats lane,Canal Street,53.47718,-2.236594,Streets,,Streets,Streets and fields,No,Hours,1828-07-27,Evening,N,1828-07,1828,July,Sunday,No
1828 - September 11,Manchester,Identity,Attaching coachman (who had held up procession of Granby Row Catholic school to Chapel),0,0,0,Coachman,Public,Property,No,No,Picadilly,"Picadilly, Manchester, UK",53.4811508,-2.2357262,Street (procession),,Street (procession),Streets and fields,No,Hours,1828-09-11,Day,Y,1828-09,1828,September,Thursday,No
1829 - January 1,Manchester,Misc (anti-police),Irish fighting. Police intervene and are attacked. (3-400),0,0,0,Police,Public,People,No,No,St George's Road,"St George's Road (Rochdale Road), Manchester, UK",53.435211,-2.2111287,Street,,Street,Streets and fields,No,Hours,1829-01-01,Day,Y,1829-01,1829,January,Thursday,No
1829 - April 5,Manchester,Identity / Misc (anti-police),London Road disturbance. Police intervene and are severly beaten. Planned fight between English and Irish in fields near Garston road (Bellevue) on Sunday but fight not finished. Challenge was renewed and they were going to fight  in fields by chapel when police arrived,0,0,0,Police,Public,People,No,No,London Road,"London Road, Manchester, UK",53.4763173,-2.2313337,Field,,Field,Streets and fields,No,Hours,1829-04-05,Day,Y,1829-04,1829,April,Sunday,No
1829 - May 3 & 4,Manchester,Economic,"Weavers strike.
Mass meetings. Attacking factories (often deliberately leaving power mills untouched). Cloth and wept thrown into the canal.
Attacking police with stones and missiles. Stoning factories before forcing way in.
Shops entered and gutted. Some coaches stopped and money demanded. 
Sending delegates to other towns to spread strike.
Covering windows of factories and coaches with dirt and mud.
Mugging respectable-looking men. 
Loaves thrown out to appease mob (which it normally did - attacked only if not forthcoming).
Levvying at pubs and private homes. Contributions received with cheers and shared amongst the crowd. Tried to burn down a mill.
Went up to bedrooms above shope and destroyed furniture, beddding and clothes. Picketing house where they  believed some knobstick was coming to take up jobs. 
Rescuing prisoners from gaol",1,1,1,"Factories, knobsticks, machinery (not power-looms).
Shops, pubs and houses above.
Private homes and respectable-looking gentlemen.
Police/troops. ",Both,Both,Yes,"Knobsticks, respectable looking gentlemen","New Cross, Oldham Road, POllard Street, Dyche street, Oldham street, St George's road, Ancoats street, Bank top, Oxford Road, Faulkner street, Upper Ancoats street, Ardwick, Granby row, Irk Street (Collyhurst), Bengal street
Stockport (Heaton Lane), Portwood and Rochdale. Nicholas street, Chorlton row, Chancery lane","St George's Field, Manchester, UK",53.490063,-2.229838,Open air meeting,St George’s Fields,Open air meeting,Streets and fields,Yes,Days,1829-05-03,All day & night,Y,1829-05,1829,May,Sunday,No
1829 - May (late),Manchester,Misc (anti-police),Crowd gathered to watch a fight. Police interfere and are attacked (some stones thrown),1,0,0,Police,Public,People,No,No,St George's Church,"St George's Church, Manchester, UK",NA,NA,Church,St George’s Church,Church,Church,No,Minutes,NA,Night,N,1829-05,1829,May,Monday,No
1829 - May 27,Manchester,Misc,Deserters being held in pub in Harperhuey in transit. Mob attack to free the prisoners,1,0,0,Pub and troops.,Public,People,No,No,Harperhuey,"Harperhuey, Manchester, UK",53.506442,-2.215505,Pub,,Pub,"Places of leisure (pubs, theatres, football grounds etc)",No,Minutes,1829-05-27,Noon,Y,1829-05,1829,May,Wednesday,No
1829 - June 6,Manchester,Identity,"Irish row, Saturday night, 11pm. Red Bull Pub  on Mason street. Galway vs Silgo men. Escalated from a simple fight as Silgo man went to pub, challenged Galway men to fight, was severly beaten. Returned with more men and general fight began. Lasted half an hour. Pokers used.",0,0,0,Irish factions fighting,Public,People,No,No,Mason Street. Pub,"Mason Street, Manchester, UK",53.4866018,-2.2334194,Pub,Red Bull Pub,Pub,"Places of leisure (pubs, theatres, football grounds etc)",No,Minutes,1829-06-06,Evening (11pm),N,1829-06,1829,June,Saturday,No
1829 - July 22,Manchester,Economic,"Attack factory (doors and windows) and force workers to turn out. 
Attacking workers with bludgeons and sticks.
Attack employer's house adjoining the factory",0,0,1,"Factory, workers.
Employer and his home",Both,Both,Yes,"Scabs, employers",Angel Street,"Angel Street, Manchester, UK",53.4878389,-2.2362381,"Factories, homes",,Factories,"Workplaces (factory, workshops, docks etc)",Yes,Hours,1829-07-22,Morning and evening,Y,1829-07,1829,July,Wednesday,No
1829 - November 11,Manchester,Misc (bailiff),"Attacking bailiffs with bludgeons, pokers and other weapons. Rescued the goods they had seized. (mob of 500)",0,0,0,Bailiffs and police,Public (Bailiff),People,No,No,Newton Lane,"Newton Lane (Oldham Road), Manchester, UK",53.486567,-2.2285,House,,House,Home,No,Minutes,1829-11-11,Morning (10am),Y,1829-11,1829,November,Wednesday,No
1830 - February 24,Manchester,Misc (bailiff),"Attacking bailiffs.
Destroying house, furniture and looms. Bonfire in the middle of the house. Came bcak next day and pulled down the rest of the hosue",0,0,0,Bailiffs. House,Public (Bailiff),People,No,No,New Town and Collyhurt,"Collyhurst, Manchester, UK",53.497904,-2.23091,House,,House,Home,No,Days,1830-02-24,Morning (9.30am) and evening,Y,1830-02,1830,February,Wednesday,No
1830 - March 17,Manchester,Identity / Misc (anti-police),"St Patricks Day celebration. Crowd returning from mass trying to cross bridge back over in Salford but find bridge keeper had shut the gate. They force their way through and attacked his house smashing windows. Police arrive, arrest someone, crowd rescue him",1,0,0,Bridge keeper's house. Police,Both,Both,Yes,Bridgekeeper,Bridge to Salford,"Bridge Street Salford, Manchester, UK",53.481523,-2.252255,Street (procession),,Street (procession),Streets and fields,No,Minutes,1830-03-17,??,,1830-03,1830,March,Wednesday,St Patrick’s Day
1830 - April 15,Manchester,Economic,Strike. Marching to other factories turning out workers. Fight with police,0,0,1,Factories and police,Public,Both,No,No,"Mather street, Dyche street, Newtown. ","Mather street (Ducie Street), Manchester, UK",53.480121,-2.229479,Factories,,Factories,"Workplaces (factory, workshops, docks etc)",Yes,Minutes,1830-04-15,Noon,Y,1830-04,1830,April,Thursday,No
1830 - July 12,Manchester,Identity,Orangemen dining in pubs. Attacked by Irish. Stoning pubs. Pulling down flags. Smashing up inside of pubs.,1,0,0,Orangemen. Pubs.,Public,Both,No,No,"Withy Grove, Long Millgate, Garrat, Bank top. ","Withy Grove, Manchester, UK",53.4846856,-2.2413423,Pub,,Pub,"Places of leisure (pubs, theatres, football grounds etc)",No,Minutes,1830-07-12,Day,Y,1830-07,1830,July,Monday,12th July
1830 - July 26,Manchester,Identity,Entering Protestant houses and beating people up in their beds. Beating up neighbours who tried to defend them. (only 8 to 10 in mob),0,0,0,Protestants. Private homes. ,Private,People,Yes,Protestants,Cropper Street,"Cropper Street, Manchester, UK",53.4805464,-2.2348396,House,,House,Home,No,Hours,1830-07-26,5:00 am,N,1830-07,1830,July,Monday,No
1830 - September 14 & 15,Manchester,Identity,"Skirmish between Orange and Irish parties. Ribandmen attack house, fire shots in and out, doors and windows destroyed. ",0,0,0,Orangemen. Private home.,Private,Both,Yes,Ribbandman,"Newtown, St George's Row","Newton, Manchester, UK",53.486567,-2.2285,House,,House,Home,No,Days,1830-09-14,Evening (8pm),N,1830-09,1830,September,Tuesday,No
1830 - November 17,Manchester,Economic,"Women and lads being employed at low prices. Pickets. Man arrested, attempt to rescue, stones and sticks thrown at police.",1,0,0,Police and workers. ,Public,People,No,No,Ancoats,"Ancoats, Manchester, UK",53.485371,-2.2281397,Factories,,Factories,"Workplaces (factory, workshops, docks etc)",Yes,Minutes,1830-11-17,Evening,N,1830-11,1830,November,Wednesday,No
1830 - December 7,Manchester,Economic,Trying to turn out workes. Break into factory. Beat the owner. Rob him of watch and gold rings,0,0,1,Employer,Public,People,No,Employer,"Cotton Street, Ancoats","Cotton Street Ancoats, Manchester, UK",53.4841213,-2.2291816,"Factories, homes",,Factories,"Workplaces (factory, workshops, docks etc)",Yes,Minutes,1830-12-07,Morning,Y,1830-12,1830,December,Tuesday,No
1831 - October 14,Manchester,Political,Mob of 100s attacking houses of people who opposed reform,0,0,0,Private homes,Private,People,Yes,Reform opposers,"London Road, Mosley street","London Road, Manchester, UK",53.475803,-2.230761,House,Specific house of ‘villain of Peterloo’,House,Home,No,Minutes,1831-10-14,Evening (9pm),N,1831-10,1831,October,Friday,No
1831 - November,Manchester,Misc (anti-police),Irish mob of women rescue prisoners who had been arrested for brewing illegal alcohol,1,0,0,Police,Public,People,No,No,George Street,"George Street, Manchester, UK",53.4783774,-2.241133,Street,,Street,Streets and fields,No,Minutes,NA,??,,1831-11,1831,November,NA,No
1832 - April 18,Manchester,Economic,"Visiting homes of weavers working for two particular employers. destroyed their pieces on the loom (mob of 200)
Eventually dispersed by police",0,0,0,Private homes (they are also workshops though...),Private,Both,Yes,Scabs,Fox street,"Fox street, Manchester, UK",53.403777,-2.170972,House,Houses of weavers (they worked at home by sounds of it),House,Home,Yes,Minutes,1832-04-18,??,,1832-04,1832,April,Wednesday,No
1832 - July 22,Manchester,Identity,Irish fighting each other. Police interfere and were attacked. Cart smashed,0,0,0,Inter-Irish beef. Police,Public,Both,No,No,St George's Road,"St George's Road (Rochdale Road), Manchester, UK",53.490595,-2.228286,Street,,Street,Streets and fields,No,Minutes,1832-07-22,Afternoon (3pm),Y,1832-07,1832,July,Sunday,No
1832 - September 2,Manchester,Misc (cholera),Attack cholera hospital. Carried partially dissected cholera victim through the streets. Liberated patients. Smashed inside of hospital,0,0,0,Cholera hospitals,Public,Both,No,No,"Swan Street, New Cross","Swan Street, Manchester, UK",53.4854361,-2.2343286,Cholera hospital,Cholera hospital,Cholera hospital,Hospital,No,Hours,1832-09-02,Evening (5pm till 3am),Y,1832-09,1832,September,Sunday,No
1832 - December 14,Manchester,Political,Breaking windows at election. Smashing windows of pubs where committee men met. Attacking committee men. Turning out factory hands. Smashed windows of factory. ,0,0,1,Committee men and their pubs. Factories.,Public,Both,No,Committee men,"Church Street, Dale street, Fountain street, High Street. Portland street. Mosley street.  And Salford","Church Street, Manchester, UK",53.4829775,-2.2374786,"Pubs, Committee meetings, factories",,"Pubs, Committee meetings, factories","Places of leisure (pubs, theatres, football grounds etc)",No,Hours,1832-12-14,Day time,Y,1832-12,1832,December,Friday,Election
1834 - July 13 & 14,Manchester,Identity,"Orange lodges attacked. Throw stones, tying green ribbons to lampposts. Stones, brickbats, sticks and bludgeons, More violence following day near pub on Oldham Road when Sexton of St George's Road church was attacked.",0,0,0,Orangemen. Home of the sexton of Saint George's church,Public,Both,No,Sexton of St George’s Road church,"Deansgate, New Cross, Market street, St George's road.","Deansgate, Manchester, UK",53.479268,-2.2489946,Street,,Street,Streets and fields,No,Days,1834-07-13,Mornings (9-10am) and afternoon,Y,1834-07,1834,July,Sunday,12th July
1835 - January 8 & 9,Manchester,Political,Fight between different electoral parties. Reformists allied with Irish. Band playing music. Broke windows of pubs where rival committee men were meeting.,0,0,0,Electoral rivals,Public,Both,No,Committee men,Salford: Greengate and Bury street.,"Greengate Salford, Manchester, UK",53.4870868,-2.2483456,"Street, pubs",,Street,Streets and fields,No,Days,1835-01-08,Afternoon (2.30pm then noon),Y,1835-01,1835,January,Thursday,Election
1835 - July 12,Manchester,Identity,Orange vs Irish fighting (in mixed area). Attacking houses where Protestants lived. Attacks on officers. Destroyed house of Protestant landlord. Next day smashed a house in St George's road where Orange flag had been hung.,0,0,0,Protestants. Private homes. ,Both,Both,Yes,Protestants,St George's road. ,"St George's Road (Rochdale Road), Manchester, UK",53.490595,-2.228286,House,,House,Home,No,Days,1835-07-12,Afternoon and evening,Y,1835-07,1835,July,Sunday,12th July
1837 - March 13,Manchester,Economic,Union men attack irish labourers (accuse them of being knobsticks). Specials intervene and attacked by whole party,0,0,0,Police and knobsticks (Irish).,Public,People,No,No,"Bird in Hand pub, Cheetham Hill","Bird in Hand pub Cheetham Hill, Manchester, UK",53.50214,-2.236892,Pub,Bird in Hand Pub,Pub,"Places of leisure (pubs, theatres, football grounds etc)",Yes,Minutes,1837-03-13,Evening,N,1837-03,1837,March,Monday,No
1837 - April 17 - 20,Manchester,Economic,"Visiting bakers shops demanding bread. Loaves then smeared in blood and carried around on poles. 
Same again few days later.",0,1,0,Provision shops. Police,Public,Both,No,No,"St George's road. Ancoats street, Oldham street, ","St George's Field, Manchester, UK",53.490063,-2.229838,Open air meeting,St George’s Fields,Open air meeting,Streets and fields,Yes,Days,1837-04-17,Afternoon and evening,Y,1837-04,1837,April,Monday,No
